<?xml version="1.0" encoding="UTF-8"?>
<AsksinPP_addon_control_file xmlns:xsi="http://www.w3.org/2001/XMLSchema-instance" xsi:noNamespaceSchemaLocation="AsksinPP_addon_control_file.xsd">
  <creator>FUEL4EP</creator>
  <device_name>HB-UNI-Sensor-AQ-BME680_KF_DEBUG</device_name>
  <device_description>universeller Luftgütesensor mit Kalman-Filter</device_description>
  <device_small_case_name>hb-uni-sensor-AQ-BME680_KF_DEBUG</device_small_case_name>
  <version>1.0</version>
  <translated_datapoints>
      <datapoint name="AQ_LEVEL">
        <index>1</index>
        <channel_type>WEATHER</channel_type>
        <string_identifier>stringTableHBAirQualityLevel</string_identifier>
        <translated_string>Luftgütegrad</translated_string>
      </datapoint>
      <datapoint name="AQ_LOG10">
        <index>2</index>
        <channel_type>WEATHER</channel_type>
        <string_identifier>stringTableHBAirQualityLog10</string_identifier>
        <translated_string>Luftqualität Log10</translated_string>
      </datapoint>
      <datapoint name="AQ_COMP_GAS_RES_RAW">
        <index>3</index>
        <channel_type>WEATHER</channel_type>
        <string_identifier>stringTableHBAQ_COMP_GAS_RES_RAW</string_identifier>
        <translated_string>T/aH kompensierter Gaswiderstand</translated_string>
      </datapoint>
      <datapoint name="AQ_COMP_GAS_RES_MIN">
        <index>4</index>
        <channel_type>WEATHER</channel_type>
        <string_identifier>stringTableHBAQ_COMP_GAS_RES_MIN</string_identifier>
        <translated_string>untere Normalisierungsreferenz des T/aH kompensierter Gaswiderstands</translated_string>
      </datapoint>
      <datapoint name="AQ_COMP_GAS_RES_MAX">
        <index>5</index>
        <channel_type>WEATHER</channel_type>
        <string_identifier>stringTableHBAQ_COMP_GAS_RES_MAX</string_identifier>
        <translated_string>obere Normalisierungsreferenz des T/aH kompensierter Gaswiderstands</translated_string>
      </datapoint>
      <datapoint name="OPERATING_VOLTAGE">
        <index>6</index>
        <channel_type>WEATHER</channel_type>
        <string_identifier>stringTableHBBatteryVoltage</string_identifier>
        <translated_string>Batteriespannung</translated_string>
      </datapoint>
    <datapoint name="ALTITUDE_ABOVE_SEA_LEVEL">
      <index>7</index>
      <channel_type>SKIP</channel_type>
      <string_identifier>stringTableHBAltitudeAboveSealevel</string_identifier>
      <translated_string>Höhe über NN</translated_string>
    </datapoint>
    <datapoint name="TRANSMIT_TIME_INTERVAL">
      <index>8</index>
      <channel_type>SKIP</channel_type>
      <string_identifier>stringTableHBTransmitTimeIntervall</string_identifier>
      <translated_string>Sendeintervall</translated_string>
    </datapoint>
    <datapoint name="MY_HUMIDITY">
      <index>9</index>
      <channel_type>WEATHER</channel_type>
      <string_identifier>stringTableHBHumidity</string_identifier>
      <translated_string>Rel. Luftfeuchtigkeit</translated_string>
    </datapoint>
    <datapoint name="TemperatureOffset">
        <index>10</index>
        <channel_type>WEATHER</channel_type>
        <string_identifier>stringTableHBTemperatureOffset</string_identifier>
        <translated_string>Temperaturoffset</translated_string>
      </datapoint>
      <datapoint name="HumidityOffset">
        <index>11</index>
        <channel_type>WEATHER</channel_type>
        <string_identifier>stringTableHBHumidityOffset</string_identifier>
        <translated_string>Luftfeuchtigkeitsoffset</translated_string>
      </datapoint>
      <datapoint name="PressureOffset">
        <index>12</index>
        <channel_type>WEATHER</channel_type>
        <string_identifier>stringTableHBPressureOffset</string_identifier>
        <translated_string>Luftdruckoffset</translated_string>
      </datapoint>
    <datapoint name="max_decay_factor_upper_limit">
        <index>13</index>
        <channel_type>WEATHER</channel_type>
        <string_identifier>stringTableHBmax_decay_factor_upper_limit</string_identifier>
        <translated_string>relative untere Schwelle der Abklingfunktion</translated_string>
      </datapoint>
      <datapoint name="max_increase_factor_lower_limit">
        <index>14</index>
        <channel_type>WEATHER</channel_type>
        <string_identifier>stringTableHBmax_increase_factor_lower_limit</string_identifier>
        <translated_string>relative obere Schwelle der Aufklingfunktion</translated_string>
      </datapoint>
  </translated_datapoints>
</AsksinPP_addon_control_file>