<?xml version="1.0" encoding="UTF-8"?>
<AsksinPP_addon_control_file xmlns:xsi="http://www.w3.org/2001/XMLSchema-instance" xsi:noNamespaceSchemaLocation="AsksinPP_addon_control_file.xsd">
  <creator>FUEL4EP</creator>
  <device_name>HB-UNI-Sensor-CO2-SCD30</device_name>
  <device_description>Sensor Kohlendioxid</device_description>
  <device_small_case_name>hb-uni-sensor-CO2-SCD30</device_small_case_name>
  <version>1.0</version>
  <translated_datapoints>
      <datapoint name="CO2">
        <index>1</index>
        <channel_type>WEATHER</channel_type>
        <string_identifier>stringTableHBCO2Sensor</string_identifier>
        <translated_string>CO2 Messwert</translated_string>
      </datapoint>
      <datapoint name="OPERATING_VOLTAGE">
        <index>2</index>
        <channel_type>WEATHER</channel_type>
        <string_identifier>stringTableHBBatteryVoltage</string_identifier>
        <translated_string>Batteriespannung</translated_string>
      </datapoint>
      <datapoint name="ACCUMULATOR_VOLTAGE">
        <index>3</index>
        <channel_type>WEATHER</channel_type>
        <string_identifier>stringTableHBAccumulatorVoltage</string_identifier>
        <translated_string>Akkumulatorspannung(ADC)</translated_string>
      </datapoint>
      <datapoint name="VCC_VOLTAGE">
        <index>4</index>
        <channel_type>WEATHER</channel_type>
        <string_identifier>stringTableHBVCCVoltage</string_identifier>
        <translated_string>VCC Spannung(ADC)</translated_string>
      </datapoint>
      <datapoint name="TemperatureOffset">
        <index>5</index>
        <channel_type>WEATHER</channel_type>
        <string_identifier>stringTableHBTemperatureOffset</string_identifier>
        <translated_string>Temperaturoffset</translated_string>
      </datapoint>
      <datapoint name="HumidityOffset">
        <index>6</index>
        <channel_type>WEATHER</channel_type>
        <string_identifier>stringTableHBHumidityOffset</string_identifier>
        <translated_string>Luftfeuchtigkeitsoffset</translated_string>
      </datapoint>
      <datapoint name="ALTITUDE_ABOVE_SEA_LEVEL">
      <index>7</index>
      <channel_type>SKIP</channel_type>
      <string_identifier>stringTableHBAltitudeAboveSealevel</string_identifier>
      <translated_string>Höhe über NN</translated_string>
    </datapoint>
    <datapoint name="TRANSMIT_TIME_INTERVAL">
      <index>8</index>
      <channel_type>SKIP</channel_type>
      <string_identifier>stringTableHBTransmitTimeIntervall</string_identifier>
      <translated_string>Sendeintervall</translated_string>
    </datapoint>
  </translated_datapoints>
</AsksinPP_addon_control_file>