<?xml version="1.0" encoding="UTF-8"?>
<AsksinPP_addon_control_file xmlns:xsi="http://www.w3.org/2001/XMLSchema-instance" xsi:noNamespaceSchemaLocation="AsksinPP_addon_control_file.xsd">
  <creator>Your_name</creator>
  <device_name>HB-UNI-Sensor-EXAMPLE</device_name>
  <device_description>universelles Testsensörchen</device_description>
  <device_small_case_name>hb-uni-sensor-EXAMPLE</device_small_case_name>
  <version>1.0</version>
  <translated_datapoints>
      <datapoint name="AQ_LEVEL">
        <index>1</index>
        <channel_type>WEATHER</channel_type>
        <string_identifier>stringTableHBAirQualityLevel</string_identifier>
        <translated_string>Luftgütegrad</translated_string>
      </datapoint>
      <datapoint name="AQ_LOG10">
        <index>2</index>
        <channel_type>WEATHER</channel_type>
        <string_identifier>stringTableHBAirQualityLog10</string_identifier>
        <translated_string>Luftqualität Log10</translated_string>
      </datapoint>
      <datapoint name="AQ_GAS_RESISTANCE_RAW">
        <index>3</index>
        <channel_type>WEATHER</channel_type>
        <string_identifier>stringTableHBGasResistanceRaw</string_identifier>
        <translated_string>Gaswiderstand</translated_string>
      </datapoint>
      <datapoint name="AQ_GAS_RESISTANCE_MIN">
        <index>4</index>
        <channel_type>WEATHER</channel_type>
        <string_identifier>stringTableHBGasResistanceMin</string_identifier>
        <translated_string>min Gaswiderstand</translated_string>
      </datapoint>
      <datapoint name="AQ_GAS_RESISTANCE_MAX">
        <index>5</index>
        <channel_type>WEATHER</channel_type>
        <string_identifier>stringTableHBGasResistanceMax</string_identifier>
        <translated_string>max Gaswiderstand</translated_string>
      </datapoint>
      <datapoint name="OPERATING_VOLTAGE">
        <index>6</index>
        <channel_type>WEATHER</channel_type>
        <string_identifier>stringTableHBBatteryVoltage</string_identifier>
        <translated_string>Batteriespannung</translated_string>
      </datapoint>
    <datapoint name="ALTITUDE_ABOVE_SEA_LEVEL">
      <index>7</index>
      <channel_type>SKIP</channel_type>
      <string_identifier>stringTableHBAltitudeAboveSealevel</string_identifier>
      <translated_string>Höhe über NN</translated_string>
    </datapoint>
    <datapoint name="TRANSMIT_TIME_INTERVAL">
      <index>8</index>
      <channel_type>SKIP</channel_type>
      <string_identifier>stringTableHBTransmitTimeIntervall</string_identifier>
      <translated_string>Sendeintervall</translated_string>
    </datapoint>
    <datapoint name="MY_HUMIDITY">
      <index>9</index>
      <channel_type>WEATHER</channel_type>
      <string_identifier>stringTableHBHumidity</string_identifier>
      <translated_string>Rel. Luftfeuchtigkeit</translated_string>
    </datapoint>
        <datapoint name="MY_TEST">
      <index>10</index>
      <channel_type>WEATHER</channel_type>
      <string_identifier>stringTableHBMY_TEST</string_identifier>
      <translated_string>Testzeichenfolge</translated_string>
    </datapoint>
  </translated_datapoints>
</AsksinPP_addon_control_file>