<?xml version="1.0" encoding="UTF-8"?>
<AsksinPP_addon_control_file xmlns:xsi="http://www.w3.org/2001/XMLSchema-instance" xsi:noNamespaceSchemaLocation="AsksinPP_addon_control_file.xsd">
  <creator>FUEL4</creator>
  <device_name>HB-UNI-SENSOR-RAD-AL53</device_name>
  <device_description>Radioaktivitätssensor</device_description>
  <device_small_case_name>hb-uni-sensor-RAD-AL53</device_small_case_name>
  <version>1.0</version>
  <translated_datapoints>
      <datapoint name="COUNTS_PER_HOUR">
        <index>1</index>
        <channel_type>HB_MEASUREMENT_RAD</channel_type>
        <string_identifier>stringTableHBCOUNTS_PER_HOUR</string_identifier>
        <translated_string>Zählimpulse pro h</translated_string>
      </datapoint>
      <datapoint name="COUNTS_PER_HOUR_MAX">
        <index>2</index>
        <channel_type>HB_MEASUREMENT_RAD</channel_type>
        <string_identifier>stringTableHBCOUNTS_PER_HOUR_MAX</string_identifier>
        <translated_string>Zählimpulse pro h max</translated_string>
      </datapoint>
      <datapoint name="COUNTS_PER_HOUR_FILTERED">
        <index>3</index>
        <channel_type>HB_MEASUREMENT_RAD</channel_type>
        <string_identifier>stringTableHBCOUNTS_PER_HOUR_FILTERED</string_identifier>
        <translated_string>Zählimpulse pro h filtered</translated_string>
      </datapoint>
      <datapoint name="COUNTS_PER_SAMPLE">
        <index>4</index>
        <channel_type>HB_MEASUREMENT_RAD</channel_type>
        <string_identifier>stringTableHBCOUNTS_PER_SAMPLE</string_identifier>
        <translated_string>Zählimpulse</translated_string>
      </datapoint>
        <datapoint name="ACCUMULATOR_VOLTAGE">
        <index>5</index>
        <channel_type>HB_MEASUREMENT_RAD</channel_type>
        <string_identifier>stringTableHBACCUMULATOR_VOLTAGE</string_identifier>
        <translated_string>Akkumulatorspannung(ADC)</translated_string>
      </datapoint>
      <datapoint name="AL53_SUPPLY_VOLTAGE">
        <index>6</index>
        <channel_type>HB_MEASUREMENT_RAD</channel_type>
        <string_identifier>stringTableHBAL53_SUPPLY_VOLTAGE</string_identifier>
        <translated_string>AL53 Betriebsspannung (ADC)</translated_string>
      </datapoint>
      <datapoint name="OPERATING_VOLTAGE">
        <index>7</index>
        <channel_type>HB_MEASUREMENT_RAD</channel_type>
        <string_identifier>stringTableHBBatteryVoltage</string_identifier>
        <translated_string>Betriebsspannung</translated_string>
      </datapoint>
  </translated_datapoints>
</AsksinPP_addon_control_file>