<?xml version="1.0" encoding="UTF-8"?>
<AsksinPP_addon_control_file xmlns:xsi="http://www.w3.org/2001/XMLSchema-instance" xsi:noNamespaceSchemaLocation="AsksinPP_addon_control_file.xsd">
  <creator>FUEL4EP</creator>
  <device_name>HB-UNI-Sensor-TH-SHT75</device_name>
  <device_description>Sensor TH</device_description>
  <device_small_case_name>hb-uni-sensor-TH-SHT75</device_small_case_name>
  <version>1.0</version>
  <translated_datapoints>
      <datapoint name="OPERATING_VOLTAGE">
        <index>1</index>
        <channel_type>WEATHER</channel_type>
        <string_identifier>stringTableHBBatteryVoltage</string_identifier>
        <translated_string>Batteriespannung</translated_string>
      </datapoint>
      <datapoint name="MY_HUMIDITY">
        <index>2</index>
        <channel_type>WEATHER</channel_type>
        <string_identifier>stringTableHBHumidity</string_identifier>
        <translated_string>Rel. Luftfeuchtigkeit</translated_string>
      </datapoint>
      <datapoint name="TRANSMIT_TIME_INTERVAL">
      <index>3</index>
      <channel_type>SKIP</channel_type>
      <string_identifier>stringTableHBTransmitTimeIntervall</string_identifier>
      <translated_string>Sendeintervall</translated_string>
    </datapoint>
  </translated_datapoints>
</AsksinPP_addon_control_file>